{
  "$schema": "ops/schemas/planning-validation.schema.json",
  "run_id": "run-20260422-auto-improve-decision-record-fallback-retry3-linux-tmp",
  "status": "WARN",
  "summary": "Mechanism run run-20260422-auto-improve-decision-record-fallback-retry3-linux-tmp is scaffolded around ops/scripts/auto_improve_iteration_persistence_runtime.py, but baseline/candidate capture and promotion evaluation have not run yet.",
  "checks": [
    {
      "id": "single_mechanism_scope",
      "status": "PASS",
      "detail": "Primary target is frozen to ops/scripts/auto_improve_iteration_persistence_runtime.py and supporting targets stay explicit.",
      "required_artifacts": [
        "seed.yaml"
      ]
    },
    {
      "id": "baseline_artifacts_planned",
      "status": "PASS",
      "detail": "Baseline eval, lint, and mechanism assessment paths are fixed under this run directory.",
      "required_artifacts": [
        "seed.yaml",
        "run-ledger.json"
      ]
    },
    {
      "id": "candidate_artifacts_planned",
      "status": "PASS",
      "detail": "Candidate eval, lint, mechanism assessment, changed-files manifest, and promotion-report paths are fixed under the same run id.",
      "required_artifacts": [
        "run-ledger.json",
        "promotion-report.json",
        "changed-files-manifest.json"
      ]
    },
    {
      "id": "target_tests_declared",
      "status": "PASS",
      "detail": "Focused test files are frozen before mutation starts.",
      "required_artifacts": [
        "seed.yaml"
      ]
    },
    {
      "id": "improvement_observations_ready",
      "status": "PASS",
      "detail": "A run-local observation file is ready for automation follow-ups discovered during execution.",
      "required_artifacts": [
        "improvement-observations.json"
      ]
    },
    {
      "id": "signoff_or_log_plan_present",
      "status": "PASS",
      "detail": "Promotion report and run-ledger already point to signoff and append-only log surfaces.",
      "required_artifacts": [
        "run-ledger.json",
        "promotion-report.json"
      ]
    }
  ],
  "open_questions": [],
  "signoff": {
    "required": true,
    "status": "pending",
    "by": "",
    "ts": ""
  },
  "next_action": "Capture baseline lint/eval/mechanism artifacts, run the mutation command, then evaluate promotion.",
  "metadata": {
    "properties": [
      {
        "name": "urn:openai:archived-run-backfill",
        "value": "{\"archive_reason\": \"run_artifact_embedded_envelope_backfill\", \"envelope_mode\": \"metadata.properties\", \"generated_at\": \"2026-04-22T14:15:20Z\", \"generated_at_source\": \"promotion-report.run-ledger.events[5].ts\", \"helper\": \"ops.scripts.backfill_archived_run_artifacts\", \"normalized_at\": \"2026-04-28T16:30:35Z\", \"source_artifact\": \"runs/run-20260422-auto-improve-decision-record-fallback-retry3-linux-tmp/planning-validation.json\"}"
      },
      {
        "name": "urn:openai:artifact-envelope",
        "value": "{\"$schema\": \"ops/schemas/planning-validation.schema.json\", \"artifact_kind\": \"planning_validation\", \"artifact_status\": \"archived\", \"currentness\": {\"checked_at\": \"2026-04-28T16:30:35Z\", \"status\": \"current\"}, \"encoding\": \"utf-8\", \"generated_at\": \"2026-04-22T14:15:20Z\", \"input_fingerprints\": {\"archived_run_payload_before_backfill\": \"8b2b532d691e6a916864bebe75a391746aa1d539ac2d75ae68b4263871b9cd19\", \"artifact_envelope_schema\": \"87fcb7b91ffc04e8180c1c3e51e309cde186ecf23f91f7974a541d0b580976de\", \"envelope_mode\": \"f9416f4de9dee1f94a28cfe3816ddf91a55b45560a990e9279c2582a6cf47e35\", \"generated_at_source\": \"548c3aab346e2cb71c272941b9c7a2133027b926e65a47252792004e5b9cded7\", \"policy\": \"7d45acc617992bca127ce0b7defb6715caac5b774dcc489acf984502cea3a402\", \"schema\": \"1fac4d1bf35458a32e3ae173a3ec94d432fd28ad499aa83276cdf1cc78ee82c9\", \"target_rel_path\": \"d21d1e3bae0ba8e659da538033e0c9a702db91e80efbaeb42dae75b3fc62cd06\"}, \"producer\": \"ops.scripts.backfill_archived_run_artifacts\", \"retention_policy\": \"archive\", \"schema_version\": 1, \"source_command\": \"python -m ops.scripts.backfill_archived_run_artifacts --vault . --path runs/run-20260422-auto-improve-decision-record-fallback-retry3-linux-tmp/planning-validation.json\", \"source_revision\": \"unknown\", \"source_tree_fingerprint\": \"681b3ba2120e13085c8a88f804d0800aca92518eca575b48555a14983433005a\"}"
      }
    ]
  }
}
