{
  "$schema": "ops/schemas/planning-validation.schema.json",
  "run_id": "run-20260507-schema-drift-manifest-followup-pressure",
  "status": "PASS",
  "summary": "Mechanism run run-20260507-schema-drift-manifest-followup-pressure is finalized with decision PROMOTE; baseline/candidate artifacts, promotion report, and run-ledger are now aligned.",
  "checks": [
    {
      "id": "mechanism_artifacts_complete",
      "status": "PASS",
      "detail": "baseline/candidate eval, lint, and mechanism assessment artifacts are present under the same run directory.",
      "required_artifacts": [
        "run-ledger.json",
        "promotion-report.json",
        "baseline-eval.json",
        "candidate-eval.json",
        "baseline-lint.json",
        "candidate-lint.json",
        "baseline-mechanism-assessment.json",
        "candidate-mechanism-assessment.json"
      ]
    },
    {
      "id": "promotion_decision_finalized",
      "status": "PASS",
      "detail": "promotion gate decision is finalized as `PROMOTE` and persisted in `promotion-report.json`.",
      "required_artifacts": [
        "promotion-report.json",
        "run-ledger.json"
      ]
    },
    {
      "id": "system_log_finalization",
      "status": "PASS",
      "detail": "append-only log entry was recorded at `system/system-log.md#2026-05-07-1248-kst-improve-finalize-mechanism-run-run-20260507-schema-drift-manifest-followup-pressure-promote`.",
      "required_artifacts": [
        "promotion-report.json",
        "run-ledger.json"
      ]
    }
  ],
  "open_questions": [],
  "signoff": {
    "required": false,
    "status": "not_required",
    "by": "",
    "ts": ""
  },
  "next_action": "Use this finalized run as future history input for mechanism_review and mutation_proposal.",
  "metadata": {
    "properties": [
      {
        "name": "urn:openai:archived-run-backfill",
        "value": "{\"archive_reason\": \"run_artifact_embedded_envelope_backfill\", \"envelope_mode\": \"metadata.properties\", \"generated_at\": \"2026-05-07T03:48:04Z\", \"generated_at_source\": \"promotion-report.run-ledger.events[9].ts\", \"helper\": \"ops.scripts.backfill_archived_run_artifacts\", \"normalized_at\": \"2026-05-07T17:17:54Z\", \"source_artifact\": \"runs/run-20260507-schema-drift-manifest-followup-pressure/planning-validation.json\"}"
      },
      {
        "name": "urn:openai:artifact-envelope",
        "value": "{\"$schema\": \"ops/schemas/planning-validation.schema.json\", \"artifact_kind\": \"planning_validation\", \"artifact_status\": \"archived\", \"currentness\": {\"checked_at\": \"2026-05-07T17:17:54Z\", \"status\": \"current\"}, \"encoding\": \"utf-8\", \"generated_at\": \"2026-05-07T03:48:04Z\", \"input_fingerprints\": {\"archived_run_payload_before_backfill\": \"7fb006de69d6c2cb976f3490165d7351b23ef16a142d50152521c55293d244e0\", \"artifact_envelope_schema\": \"87fcb7b91ffc04e8180c1c3e51e309cde186ecf23f91f7974a541d0b580976de\", \"envelope_mode\": \"f9416f4de9dee1f94a28cfe3816ddf91a55b45560a990e9279c2582a6cf47e35\", \"generated_at_source\": \"59a625030a1f2de81a8e34e10da4fd7691e8914cf2b6297979f668d409c46411\", \"policy\": \"0ea507a6c856f415081476dad6bc1b650390c534db7dc9ffdd30bf4b634bf107\", \"schema\": \"1fac4d1bf35458a32e3ae173a3ec94d432fd28ad499aa83276cdf1cc78ee82c9\", \"target_rel_path\": \"d53610c408c1027dad199eb959cf116ef33e8b1745a579b75432a7f2d2a4a1fe\"}, \"producer\": \"ops.scripts.backfill_archived_run_artifacts\", \"retention_policy\": \"archive\", \"schema_version\": 1, \"source_command\": \"python -m ops.scripts.backfill_archived_run_artifacts --vault . --path runs/run-20260507-schema-drift-manifest-followup-pressure/planning-validation.json\", \"source_revision\": \"unknown\", \"source_tree_fingerprint\": \"a29a1f5a6ec3e4ac4ac8d79cc69437a5f5e5b6bc55285a780721c53e67d5149d\"}"
      }
    ]
  }
}
